nid,vid,type,language,title,body,uid,status,date,changed,comment,promote,sticky,tnid,translate12941,16041,community_updates,und,Legislative Update December 2014 - Sale Homes in Community Landlord Tenant Conflict - Habitability Under Space - Political Reality Check,"<p><span style=""font-size:14px;""><span style=""font-family:arial,helvetica,sans-serif;"">The Manufactured Housing Landlord-Tenant Coalition met again this month to discuss a number of issues as we head into the 2015 Oregon Legislative Session that is just over a month away.</span></span></p><p>&nbsp;</p><p><span style=""font-size:14px;""><span style=""font-family:arial,helvetica,sans-serif;""><strong><u>Lengthy Discussion on Competing Sales Conflict""</u></strong></span></span></p><p>&nbsp;</p><p><span style=""""font-size:14px;""""><span style=""""font-family:arial",23,1,1419277308,1511230134,1,0,0,0,012949,16049,community_updates,und,Legislative Update - Jan 2015 - Unpaid Taxes on Homes - Habitability - In Park Sales Conflict - House Keeping,"<p>The 2015 Oregon Legislative Session convened this month with House and Senate Committees beginning their work the first week in February.&nbsp; There are a wide variety of issues the Oregon Legislature will be dealing with - many being repeats from previous sessions such as education funding and taxes that never seem to go away.</p><p>&nbsp;</p><p>The Manufactured Housing Landlord-Tenant Coalition continues to work on possible legislation.&nbsp; The group has been meeting since June 2014 - at least once a month to address a variety of issues.&nbsp; The issues have been significantly narrowed down as we rapidly approach the end of these negotiations.&nbsp; The odds are that there will either be a compromise bill (typically know as the coalition bill) or we could face some nasty political battles on some onerous legislation.&nbsp; The coalition provides a venue for both landlords and tenants to work through selected issues.&nbsp; In general the coalition's work tends to be better thought out than most of the knee jerk legislative proposals we see from individual legislators.&nbsp;</p><p>&nbsp;</p><p>The biggest challenge of any negotiation process is the end - reaching a final compromise.&nbsp; &nbsp;We all know, compromise is something that is not easily accomplished in today's political environment.&nbsp; Perhaps the best sign of a successful compromise is when both sides are unsatisfied with the final product.&nbsp; Having worked on coalition bills since 1999 most times both sides grumble their way to agreement.&nbsp; I suspect this year will be no different.</p><p>&nbsp;</p><p>Over the last six months MHCO has posted updates on the issues we have been working. There are now four issues in the proposed 2015 Coalition Bill.&nbsp; Many of these issues are complicated and consume pages of proposed legal language.&nbsp; We will spare you that in this report but will try to convey the key substance of each issue.&nbsp; The following is a summary of where those issues stand in very broad brushstrokes:</p><p>&nbsp;</p><p><strong><u>1. Unpaid Taxes on Abandoned Homes</u></strong></p><p>&nbsp;</p><p>The County Tax Collector and the Oregon Department of Revenue have agreed to cancel all unpaid property taxes and special assessments as provided under ORS 311.790.&nbsp; There is no limit on the market value of the home or limit on the amount of tax to be canceled.</p><p>&nbsp;</p><p>In general, in order to obtain the tax cancelation of unpaid taxes on an abandoned home the landlord will be required to file an affidavit with the county tax collector stating that the landlord will sell the property in an arms length transaction to an unrelated buyer who intends to occupy the property in that facility.&nbsp; Once the home is sold by the landlord another affidavit or declaration with the county tax collector would have to be filed stating that the landlord has sold the property, the sale price and description of any costs incurred by the landlord to improve the property for sale.</p><p>&nbsp;</p><p>MHCO will create these affidavits as new MHCO Forms for community owners or managers to utilize.&nbsp;</p><p>&nbsp;</p><p>This is an issue MHCO has wanted to address over the past ten years.&nbsp; We are very happy that the issue is finally resolved and the unpaid taxes on an abandoned home will be completely eliminated.&nbsp; This will impact nearly every community in the state of Oregon. &nbsp;</p><p>&nbsp;</p><p>In addition, on a separate issue there will also be and increase in the yearly fee paid by community owners paid to Oregon Housing and Community Services.&nbsp; The department will charge $50 for communities with more than 20 spaces and $25 for those communities with less than 20 spaces.&nbsp; Under ORS 446.525 the special assessment levied annual upon each manufactured dwelling will increase from $6 to $10.&nbsp; This &nbsp;$10 assessment is to be paid by the tenants.</p><p>&nbsp;</p><p><strong><u>2. Habitability - Ground Support, Natural Gas and Garbage Cans</u></strong></p><p>&nbsp;</p><p>This issue has been significantly altered since it was first introduced last summer.&nbsp;</p><p>&nbsp;</p><p>One of the main concerns the residents have is being able to cancel a rental agreement or lease if the foundation of their home is partially washed away.&nbsp; The proposed language is: For manufactured dwellings only",23,1,1422373540,1511230134,1,0,0,0,012970,16070,community_updates,und,Landlord - Tenant Coalition Negotiations Concluded - MHCO Board of Directors Unanimously Vote To Support Proposal,"<p>Last week the Manufactured Housing Landlord Tenant Coalition held it's final meeting.&nbsp; Some changes were made to the In Park Sales Conflict"" issue but the other three issues remained substantially unchanged from our meeting in January.&nbsp;</p><p>&nbsp;</p><p>The MHCO Board of Directors has reviewed the proposed coalition bill and voted unanimously to support the proposed legislation.&nbsp; Phil Querin is working on some last minute adjustments to the ""In Park Sales"" section of the proposal.&nbsp; The coalition proposal will go to Legislative Counsel early this week to be drafted into a House Bill.&nbsp;</p><p>&nbsp;</p><p>MHCO has been working on bi-partisan support for the proposal.&nbsp; There will be Democratic and Republican sponsors.&nbsp;&nbsp; All this should make it easier to pass the proposal this spring.&nbsp; In all likelihood the public hearing for this bill will be in March.</p><p>&nbsp;</p><p>Here is a brief summary of the proposed legislation:</p><p>&nbsp;</p><p>&nbsp;</p><p><u>1. Unpaid Taxes on Abandoned Homes</u></p><p>&nbsp;</p><p>This issue was MHCO's top legislative priority for the 2015 Legislative Session.&nbsp; We are very happy with the agreement that we were able to reach which nearly eliminates all unpaid taxes on an abandoned home.</p><p>&nbsp;</p><p>&nbsp;</p><p>In general",23,1,1424114666,1511230134,1,0,0,0,012978,16078,community_updates,und,Manufactured Housing Coalition Legislation (HB 3016) Begins Moving in Oregon Legislature,"<p>On Monday, March 9th the Oregon House Revenue Committee held a Public Hearing and Work Session on HB 3016 - also known as the Manufactured Housing Landlord Tenant Coalition Bill. &nbsp;The House Revenue Committee voted unaminsously to pass the bill to&nbsp;the House Human Services and Housing Committee. We expect to have one &nbsp;public hearing and work session in this committee before the bill (hopefully) moves to the Oregon House floor for a vote.</p><p>In February the MHCO&nbsp;Board of Directors unanimously voted in support of the proposed legislation.</p><p>&nbsp;</p><p><u><strong>SUMMARY OF HB 3016, WITH AMENDMENTS, REGARDING MANUFACTURED HOME PARK TENANCIES: The Manufactured Housing Landlord/Tenant Coalition Bill</strong></u></p><p>Introduction: The Manufactured Housing Landlord/Tenant Coalition, which has had a negotiated compromise bill in every session since 1997, is the source of HB 3016. The coalition consists of MH park residents, landlords, manufacturers, and other interested parties. It met 11 times between May 2014 and February 2015, for three hours each, to negotiate this bill. There are no known opponents of the bill.</p><p>A. THE PRINTED BILL: Three fixes"" to the 2014 Opportunity to Purchase bill",23,1,1426013627,1512941616,1,0,0,0,012987,16087,community_updates,und,US Congress Moves Legislation to Protect Availability of Financing for Manufactured Homes,"<p align=""center"" style=""color: rgb(29, 29, 29); font-family: Calibri, Verdana, Helvetica, Arial, sans-serif; line-height: normal; text-align: center; margin-top: 0px; margin-bottom: 0px; font-size: 16pt;""><span style=""font-family: Calibri, sans-serif; text-align: justify;""><strong>H.R. 650 Clears Key Hurdle in U.S. House</strong></span></p><p style=""color: rgb(29, 29, 29); font-family: Calibri, Verdana, Helvetica, Arial, sans-serif; font-size: 15px; line-height: normal; margin-top: 0px; margin-bottom: 0px;"">&nbsp;</p><p align=""justify"" style=""color: rgb(29, 29, 29); font-family: Calibri, Verdana, Helvetica, Arial, sans-serif; font-size: 15px; line-height: normal; text-align: justify; margin-top: 0px; margin-bottom: 0px;""><span style=""font-family: Calibri, sans-serif; font-size: 11pt;"">The House Financial Services Committee today passed H.R. 650, bipartisan legislation to protect the availability of financing for manufactured homes.</span><i style=""font-family: Calibri, sans-serif; font-size: 11pt;"">&nbsp;&nbsp;</i><span style=""font-family: Calibri, sans-serif; font-size: 11pt;"">Introduced by Representatives Stephen Fincher (R-TN), Terri Sewell (D-AL), Andy Barr (R-KY), and Kyrsten Sinema (D-AZ), the bill protects the ability of manufactured home customers to buy, sell and refinance manufactured homes, the largest form of unsubsidized affordable housing in the nation.</span></p><p style=""color: rgb(29, 29, 29); font-family: Calibri, Verdana, Helvetica, Arial, sans-serif; font-size: 15px; line-height: normal; text-align: justify; margin-top: 0px; margin-bottom: 0px;""><span style=""font-size: 11pt; font-family: Calibri, sans-serif;""><i>&nbsp;</i></span></p><p style=""color: rgb(29, 29, 29); font-family: Calibri, Verdana, Helvetica, Arial, sans-serif; font-size: 15px; line-height: normal; margin: 0in 0in 0.0001pt; text-align: justify;""><span style=""font-size: 11pt; font-family: Calibri, sans-serif;"">H.R. 650 is cosponsored by 41 members of the House of Representatives. &nbsp;<span style=""text-decoration: underline;""><a href=""http://r20.rs6.net/tn.jsp?f=001gzhrb4s851BMdeI3kZFQWGIykXlhFZQjJXIoHVyXf9epwP5hTYstdz2EFzAveJsdy6z341UMKHVvqlCSCFT-Tyf4z8b4vHAK3ITaTDa0P20fQ9BS-iAf9RPhCYG6ml5D9wJQD2LVa0Raff9Lj3Nt7nIFtYUkDukej9AuPIGJYj6dUoLCEAX_dpqmqOQzLd-9v0dUio6Meu_bBt01-P8j0U96Oe7xOWhpMzwIoLFKRquoBlrdh_KAzQ==&amp;c=ccdHPSshGAnB63VVS8vjvcDQottEPseF3IU8-l6GZN9EemapKzPJcw==&amp;ch=aDc09hB50TFi80RkCjmnmA7XOkf14xt6a704mIiviW8aJ5uOKLjkDw=="" linktype=""1"" shape=""rect"" style=""color: blue;"" target=""_blank"" track=""on"">Click here to see the current cosponsor list</a></span>. &nbsp;In addition to MHI, H.R. 650 is supported by the National Association of Realtors, Mortgage Bankers Association, and the National Association of Federal Credit Unions.</span></p><p style=""color: rgb(29, 29, 29); font-family: Calibri, Verdana, Helvetica, Arial, sans-serif; font-size: 15px; line-height: normal; margin: 0in 0in 0.0001pt; text-align: justify;""><span style=""font-size: 11pt; font-family: Calibri, sans-serif;"">&nbsp;</span></p><p style=""color: rgb(29, 29, 29); font-family: Calibri, Verdana, Helvetica, Arial, sans-serif; font-size: 15px; line-height: normal; text-align: justify; margin-top: 0px; margin-bottom: 0px;""><span style=""font-size: 11pt; font-family: Calibri, sans-serif;"">During the Committee's consideration of the legislation, the bill's champions discussed the importance of H.R. 650 to working families across America. Representatives Fincher (R-TN), Pearce (R-NM), Neugebauer (R-TX), Sinema (D-AZ), Barr (R-KY), Hensarling (R-TX), Hill (R-AR), Stivers (R-OH), and Love (R-UT) spoke in favor of the bill during the debate. Representatives Ellison (D-MN) and Waters (D-CA) spoke in opposition to the bill. &nbsp;<span style=""text-decoration: underline;""><a href=""http://r20.rs6.net/tn.jsp?f=001gzhrb4s851BMdeI3kZFQWGIykXlhFZQjJXIoHVyXf9epwP5hTYstdz2EFzAveJsd7ljYjEgZ-W2OI7FBqfPgylX2NDG9HXpkooakiEH1cd6zMbJGFf9mcP_g9n8Vfyo5v4UiOz9IjnlQ3JKMI48PcVWXPWuIBC1RTU9cHn85_O9EW8wyZxem3_hKsM-c_Dkr6J2VGS2ESSumtlreVMxtcv9JJUpmq9HeAFfDbU9pvk51kr0oNuDgZFYrS0NOxjNO-sWHe4aJtv_Xx1zwgoUVnA==&amp;c=ccdHPSshGAnB63VVS8vjvcDQottEPseF3IU8-l6GZN9EemapKzPJcw==&amp;ch=aDc09hB50TFi80RkCjmnmA7XOkf14xt6a704mIiviW8aJ5uOKLjkDw=="" shape=""rect"" target=""_blank"">Click here to watch the bill debate (starts at 4:09).</a></span></span></p><p style=""color: rgb(29, 29, 29); font-family: Calibri, Verdana, Helvetica, Arial, sans-serif; font-size: 15px; line-height: normal; text-align: justify; margin-top: 0px; margin-bottom: 0px;""><span style=""font-size: 11pt; font-family: Calibri, sans-serif;"">&nbsp;</span></p><p style=""color: rgb(29, 29, 29); font-family: Calibri, Verdana, Helvetica, Arial, sans-serif; font-size: 15px; line-height: normal; margin-left: 0in; text-align: justify; margin-top: 0px; margin-bottom: 0px;""><span style=""font-size: 11pt; font-family: Calibri, sans-serif;"">In his remarks, Representative Fincher emphasized the bipartisan efforts to move the bill through the process: ""This is not a Democrat or a Republican issue, it is an affordability of housing issue for rural America. We cannot forget about rural America - these are my constituents and many of yours.""</span></p><p style=""color: rgb(29, 29, 29); font-family: Calibri, Verdana, Helvetica, Arial, sans-serif; font-size: 15px; line-height: normal; margin-left: 0in; text-align: justify; margin-top: 0px; margin-bottom: 0px;""><span style=""font-size: 11pt; font-family: Calibri, sans-serif;"">&nbsp;</span></p><p style=""color: rgb(29, 29, 29); font-family: Calibri, Verdana, Helvetica, Arial, sans-serif; font-size: 15px; line-height: normal; margin: 0in 0in 0.0001pt; text-align: justify;""><span style=""font-size: 11pt; font-family: Calibri, sans-serif;"">The final Committee vote was 43 in favor and 15 opposed. &nbsp;<span style=""text-decoration: underline;""><a href=""http://r20.rs6.net/tn.jsp?f=001gzhrb4s851BMdeI3kZFQWGIykXlhFZQjJXIoHVyXf9epwP5hTYstdz2EFzAveJsdhZ3SyVpffzTBLOBXYJYX9ox5l_9wbwkR4Cfe4hritLNB78F5KC2zrtnZmWCLFSc7Pke09RbVrJQ8xsodEAAZrY8i0YTGEoyfVOvhtg_ZuEawreOKUaYXORKHiVgthhZ1Q_ATx6gzC2SF07yGrC2dOS0P7fzfjVkktDRay_QT81Dr1bzMN8MQ-w==&amp;c=ccdHPSshGAnB63VVS8vjvcDQottEPseF3IU8-l6GZN9EemapKzPJcw==&amp;ch=aDc09hB50TFi80RkCjmnmA7XOkf14xt6a704mIiviW8aJ5uOKLjkDw=="" linktype=""1"" shape=""rect"" style=""color: blue;"" target=""_blank"" track=""on"">Click here to see the Committee Roster of the vote</a></span>. &nbsp;The bill was considered at the first markup of the 114<sup>th</sup>&nbsp;Congress to make changes to the Dodd Frank Act. Ten other bipartisan bills - all designed to help strengthen the economy and consumer choice by relieving harmful regulatory burdens imposed by Washington - were also passed.</span></p><p style=""color: rgb(29, 29, 29); font-family: Calibri, Verdana, Helvetica, Arial, sans-serif; font-size: 15px; line-height: normal; margin: 0in 0in 0.0001pt; text-align: justify;""><span style=""font-size: 11pt; font-family: Calibri, sans-serif;"">&nbsp;</span></p><p style=""color: rgb(29, 29, 29); font-family: Calibri, Verdana, Helvetica, Arial, sans-serif; font-size: 15px; line-height: normal; margin: 0in 0in 0.0001pt; text-align: justify;""><span style=""font-size: 11pt; font-family: Calibri, sans-serif;"">H.R. 650 is now ready for consideration by the full House of Representatives. In addition, a companion bipartisan bill (S. 682) has been introduced in the Senate by<span class=""st1"">&nbsp;Senators Donnelly (D-IN), Toomey (R-PA), Manchin (D-WV), and Cotton (R-AR).</span></span></p>",23,1,1427409035,1427409035,1,0,0,0,012998,16098,community_updates,und,Legislative Update - Coalition Bill Passes Key Legislative Hurdle - Rent Control Discussion is Back!,"<p>&nbsp;</p><p>Yesterday afternoon the coalition bill (HB 3016) passed out of the House Human Services and Housing Committee late yesterday afternoon on a unanimous vote. &nbsp;Representative Parrish (R - West Linn) will carry the bill. &nbsp; &nbsp;I expect the bill to pass out of the House later next week.&nbsp; This legislation contains language that eliminates the landlords responsibility to pay past due taxes when he or she purchases an abandoned home in their community.&nbsp; The past due tax on abandoned homes"" is MHCO's top legislative issue for this legislative session.&nbsp;&nbsp; After trying to address this issue for the past 12 years we are thrilled that we are finally moving forward on an issue that is important to every community in Oregon.</p><p>&nbsp;</p><p>Unfortunately",23,1,1429028171,1511230134,1,0,0,0,013000,16100,community_updates,und,Legislative Update - Key Legislation Passes in Oregon House.,"<p><span style=""font-family: Arial, Helvetica, sans-serif; line-height: 16.200000762939453px;"">On Monday morning the&nbsp;Oregon House of Reprentatives unanimously passed HB 3016 - the manufactured home landlord-tenant bill. This legislation contains the elimination of past due property taxes on an abandoned home when the community owner wants to purchase the abandoned home. This is MHCO's top legislative issue. We now move on to the Oregon Senate.</span></p>",23,1,1429623847,1512941616,1,0,0,0,013001,16101,community_updates,und,"Legislative Update - Legislative Task Force, Discussions on Rent, Coalition Bill","<p>The last two weeks in the Oregon Legislature have been hectic.&nbsp; Yesterday was the deadline for bills in their originating chamber to move out of that chamber.&nbsp; In other words, House bills need to be out of House Committees and Senate bills had to be out of the Senate.&nbsp; This results in a large number of legislative proposals not moving forward which almost always is a good thing.&nbsp; The ten days leading up to this deadline is intense with lots of last minute proposals struggling to move out of committee.</p><p>&nbsp;</p><p><strong>HB 3016 Coalition Bill - Sails Out of Oregon House </strong></p><p>&nbsp;</p><p>There are three legislative proposals MHCO has been closely monitoring and lobbying.&nbsp; The first is the coalition bill with the language on past due taxes on abandoned homes (HB 3016).&nbsp; MHCO enthusiastically supports this bill - it is our top legislative priority.&nbsp; As reported earlier this week the this legislative proposal passed out of the Oregon House of Representatives on a unanimous vote (60-0) in favor.&nbsp;</p><p>&nbsp;</p><p><strong>HB 2564 - Rent Discussions</strong></p><p>&nbsp;</p><p>Unfortunately, the issue of rent in manufactured home communities received traction in both the House and Senate over the past 10 days.&nbsp; In the House a proposal on inclusionary zoning (HB 2564) started to attract some discussion on rent and indirectly rent control.&nbsp; HB 2564 lifts the &nbsp;statewide preemption on inclusionary zoning (ORS 197.309) in Oregon.&nbsp; As the discussion on this legislation moved forward it attracted interest in repealing the statewide preemption on rent control (ORS 91.255).&nbsp; The House did <strong><em><u>NOT</u></em></strong> add that language, but it was tangentially mentioned in the House floor debate.&nbsp; Here are three excerpts from the HB 2564 House floor debate that are concerning:</p><p>&nbsp;</p><ul style=""list-style-type:circle;"">	<li>Rep Gallegos (D-Hillsboro)&nbsp; - Colleagues while I am supportive of 2564",23,1,1429720875,1511230134,1,0,0,0,013013,16113,community_updates,und,Legislative Update:  Senate Action on Coalition Bill and a PROPOSED Rent Control Amendment,"<p>This morning the Oregon State Senate passed the 2015 Landlord-Tenant Coalition Bill on a vote of 29-0 with one Senator absent.&nbsp; The bill now moves on to Governor Kate Brown's desk for signature.&nbsp;</p><p>&nbsp;</p><p>MHCO is <strong>THRILLED</strong> that a long standing legislative goal - the <strong><em>ELIMINATION</em></strong> of the requirement that landlords pay the back taxes on an abandoned home in their community when the landlord purchases the abandoned home is well on it's way to becoming Oregon law.&nbsp; <strong><em><u>This portion of the legislation will become effective January 1, 2016.</u></em></strong>&nbsp; MHCO along with Phil Querin have already created initial drafts of the forms necessary to comply with the new law.&nbsp; Those forms will be reviewed and available to members on-line later this year.&nbsp; We will also have an extensive article by Phil Querin available for the MHCO membership later this year as well.&nbsp; Other issues contained in this legislation will be addressed at the annual MHCO Conference at the end of October.&nbsp; Stay tuned for details!</p><p>&nbsp;</p><p><strong><em>This is a major win for Oregon community owners and will impact every community owner in the state.</em></strong>&nbsp; Special thanks to Dale Strom, Adam Cook and Phil Taylor who dedicated an enormous amount of time negotiating on behalf of community owners in the landlord tenant coalition.&nbsp;&nbsp; MHCO also thanks Diane Belt with the Oregon Tax Assessors Association for her expertise and willingness to resolve this issue.&nbsp;</p><p>&nbsp;</p><p>There have also been some less than satisfactory developments in Salem this week.</p><p>&nbsp;</p><p>Yesterday the Oregon Senate Committee on Human Services and Early Childhood held a public hearing on HB 2564. &nbsp;This is the inclusionary zoning"" bill that passed the Oregon House earlier this session. &nbsp;It is also the bill that Representatives in the House alluded to the as needing a rent control amendment during the floor debate in the Oregon House last month.</p><p>&nbsp;</p><p>At yesterday's public hearing an amendment (the dash 5 amendment) was introduced that would chip away at the statewide preemption on rent control. &nbsp;</p><p>&nbsp;</p><p>Here is Phil Querin's analysis of the proposed amendment:</p><p>&nbsp;</p><p style=""""margin-left:.5in;"""">""When the bill attempts to exclude the application of <a href=""""http://www.oregonlaws.org/ors/91.225"""">ORS 91.225</a> (which prohibits rent control)",23,1,1432159890,1511230134,1,0,0,0,013016,16116,community_updates,und,Legislative Update:  A Signature and a Move to Rules,"<div style=""color: rgb(0, 0, 0); font-family: Helvetica; font-size: 12px; line-height: normal;""><span style=""font-size: 14px;"">Yesterday, Oregon Governor Kate Brown signed the coalition bill (HB 3016). &nbsp;The abandonment/past due tax portion of the bill will go into effect on January 1, 2016. MHCO has already&nbsp;been working with Phil Querin and Diane Belt (Oregon Tax Assessors) to create the forms necessary to take advantage of the new law. &nbsp;Those forms will be uploaded to MHCO.ORG at the end of the year. &nbsp;Phil Querin&nbsp;will do an article later this year on the changes in abandonment law that will go into effect in 2016. &nbsp;MHCO is also planing a seminar with Phil Querin&nbsp;reviewing the other portions of the new law at the MHCO Annual Conference at the end of October in Eugene. &nbsp;&nbsp;This is a bill that MHCO has worked for over the last decade and we are very pleased that this onerous tax policy is now part of Oregon's past. &nbsp;Thank you to everyone involved in this process, especially Diane Belt (Oregon Tax Assessors).</span></div><div style=""color: rgb(0, 0, 0); font-family: Helvetica; font-size: 12px; line-height: normal;"">&nbsp;</div><div style=""color: rgb(0, 0, 0); font-family: Helvetica; font-size: 12px; line-height: normal;""><span style=""font-size: 14px;"">As many of you know the other issue&nbsp;&nbsp;MHCO&nbsp;has been monitoring is&nbsp;Inclusionary zoning"" (HB 2564). &nbsp;Yesterday HB 2564&nbsp;passed out of the Senate Committee on Human Services and Early Childhood Development to the Senate Rules Committee. &nbsp;The rent control amendment (dash 5) was not adopted. &nbsp;At this point in the legislative process&nbsp;it is unlikely (but not impossible)&nbsp;a new amendment on rent control will be added to&nbsp;the inclusionary zoning bill. &nbsp;MHCO had hoped that the bill would either die in the Human Services Committee or move to the Senate floor without the dash five amendment. &nbsp;The move to Rules simply drags the process out longer for further debate and negotiation.</span></div><div style=""""color: rgb(0",23,1,1433343574,1511230134,1,0,0,0,0