nid,vid,type,language,title,body,uid,status,date,changed,comment,promote,sticky,tnid,translate34,13234,community_updates,und,Documents Provided To Prospective Residents,"<p>When the prospective resident returns a complete and accurate written rental application, you should provide the applicant the following:</p><ul><li>A copy of the rules and regulations (if not provided earlier)</li><li>Rental agreement form</li><li>Statement of policy (if not provided earlier)</li><li>Rent history of the space</li><li>Criminal check authorization</li><li>Resident applicant screening fee should be acquired prior to accepting the individual as a resident.  ""Application Screening Fee and Receipt"" form is to be signed by a manager when applicant's fees are accepted.</li><li>The landlord must give written notice of what the tenant screening or consumer credit report entails, the landlord's charge for the screening, and the applicant's right to dispute the screening service or credit reporting agency's information if the application is denied based on the credit report.</li><li>Minimum Criteria Standards</li></ul><p>At this point the above documents are to be provided to the prospective applicant.  However, only the application, the criminal check authorization and the applicant screening fee notice and receipt should be signed by the tenant.  The other documents are not to be signed until the application and background checks are completed and the applicant is approved.  The additional documents that are provided when the applicant returns the rental application are provided to the prospective tenant for their information so that they may be aware of the facts and make the housing choice that is right for them.<span>&nbsp;</span></p>",839,1,1297206963,1402693692,1,0,0,0,037,13237,community_updates,und,Screening Fees and Notice,"<p>A landlord may require payment of an applicant screening charge solely to cover the costs of obtaining information about an applicant as the landlord processes the application for a rental agreement.  (ORS 90.295) This activity is known as screening, and includes but is not limited to checking reference and obtaining a consumer credit report or tenant screening report.  The landlord must provide the applicant with a receipt for any applicant screening charge.</p><p>The amount of any applicant screening charge shall not be greater than the landlord's average actual cost of screening applicants.  Actual cost may include the cost of using a tenant screening company or a consumer credit reporting agency, and may include the reasonable value of any time spent by the landlord or the landlord's agents in otherwise obtaining information on applicants.  In any case, the applicant screening charge may not be greater than the customary  amount charged by tenant screening companies or consumer credit reporting agencies for comparable level of screening.</p><p>A landlord may not require payment of an applicant screening charge unless prior to the accepting the payment the landlord:</p><ol><li>Adopts written screening or admission criteria</li><li>Gives written notice to the applicant of:<ol><li>the amount of the screening charge</li><li>the screening or admission criteria</li><li>the process that the landlord typically will follow</li><li>the applicant's rights to dispute the accuracy of any information provided.<span>&nbsp;</span></li></ol></li></ol>",839,1,1297206939,1402693692,1,0,0,0,038,13238,community_updates,und,Tenant Files,"<p>Before any tenant moves into your community the tenant's file should contain the following information:</p><ol><li>Completed Application</li><li>Signed Rental Agreement. (Resident is to receive a copy)</li><li>Signed Rules and Regulations (Resident is to receive a copy)</li><li>Signed Statement of Policy including Rent History Addendum. (Tenant is to have received a copy of the Statement of Policy prior to signing rental agreement.)</li><li>Copy of Homeowner's insurance policy with community named as an interested party (for the purpose of being notified of cancellation of insurance.  (This is for pets only.)</li><li>Credit check results</li><li>Rental check results</li><li>Criminal check results</li><li>Application screening fee receipt</li><li>Pet Agreement  -  Identify type of pet, name, size.  You might consider taking a picture of the pet to include in your file in case you need to identify the pet in the future.  Resident must sign the pet agreement. (Resident is to receive a copy)</li><li>Proof of Age if 55 and older community (photo ID, driver's license)</li><li>RV Storage Agreement.  Identify type of RV (i.e. boat, camper, trailer, etc.) and include license number and description of recreational vehicle. (Resident is to receive a copy)</li></ol><p>Any and all notices/correspondence between landlord/manager and resident<span>&nbsp;</span></p>",839,1,1303336681,1402693692,1,0,0,0,040,13240,community_updates,und,"Department of Housing & Urban Development Requires Re-survey of ""Older Persons""","<p>We all know that 80% or more of a community homesites must be occupied by at least one 55+ person, and that documented proof of age must be consistently required to qualify for 55+ status under HOPA.  Let's not forget that the requirements also mandate the re-survey.</p><p>What do the Regulations say?  ""...The procedures described in paragraph (b) [routinely determining the occupancy of each unit, including the identification of whether at least one occupant of each unit is 55 years of age or older] ... must provide for regular updates, through surveys or other means, of the initial information supplied by the occupants of the housing facility or community.  Such updates must take place once every two years ....""</p><p>For example, there were objections to the re-survey mandate on the grounds it was too burdensome.  HUD stated that owners would not be unduly burdened by the update requirements since the information ""will be readily available in the files.""</p><p>This comment reflects that the survey requirement can be fulfilled by preparation of a summary of names and ages of the homeowners based on existing file information (assuming the files are up to date).  One might annotate a rent roll with resident ages and satisfy the requirement.  HUD emphasizes that ""...the re-survey does not require that all supporting documents be collected again  -  only that the community confirm that those persons counted as occupying dwellings for purposes of meeting the 80% requirement are, in fact, still in occupancy.""</p><p>It is also clear that the survey is a ""summary"" and not required to include underlying documentation (remember the POA must be obtained for approval of tenancy and kept in the resident's file): ""[Only the overall survey summary is required to be available for review, not the supporting documentation.  The word 'summary' has been added to this section"").</p><h2>Compilation of the ""Summary""</h2><p>In review of the files to compile the required ""summary,"" it is possible that some files may be missing POA (Proof of Age) documentation.  Missing POA reflects inconsistent conformance to a required age verification policy.  This can be fatal to defending a ""55+"" status.  Yet, there are plausible reasons why POA may be absent.  Perhaps a resident's tenancy commenced before the date of enactment of the Fair Housing Amendments Act of 1988 (September 12, 1988): this was the last date to ""grandfather"" underage residents excluded from the calculation of the 80-20 requirement; perhaps the Xerox copier did not work on the day identification was checked; perhaps the applicant's age was so obvious that documentation was overlooked; perhaps the POA was misplaced.  None of these explanations will ""wash"" with fair housing enforcers.  Now is the time for review of this information.  Supplementing resident files may bolster a defense of the ""55+"" status by proving the 80-20 ratio, but cannot substitute for consistent conformance to a policy of seeking POA documentation.  HUD's requirements are crystal clear: ""The housing facility or community must establish and maintain appropriate policies to require that occupants comply with the age verification procedures required by this section.""</p><h2>Should you seek missing POA information?</h2><p>Yes.  In a large scale review of resident files by fair housing enforcers, the main objective for review of proof of age may be to establish the 80-20 ratio: Proof of age in the file may itself be seen as evidence of adherence to collection of required data:  even after-acquired information reflects, at least, compliance with the 2-year survey requirement.  Proof of age includes</p><p>the following: driver's license (an expired or out-of-state license seems 'ok'), birth certificate, passport, immigration card, military identification, any other state, local, national, or international official documents containing a birth date of ""comparable reliability.""  This may include birth certificates, baptismal or marriage documents, perhaps, and other public records.</p><h2>What if the tenant refuses to provide proof of age?</h2><p>New purchaser:  Of course, refusal to supply proof of age when applying for tenancy is a basis for denying a tenancy application.  The regulations also allow for a declaration from a member of the household over 18 years of age, stating that at least one person in the homesite is at least 55 years of age.  This after-acquired information is permissible for the survey, but again does not bolster evidence of conformance to proof of age documentation required for tenancy approval.</p><p>HUD provides a skeletal sample of certification.  This can also be used as part of the tenancy application alone or better yet as a backup to production of proof of age.  The sample reads as follows: ""I, (name), am 18 years of age or older and a member of the household that resides at (housing facility or community), (unit number or designation).  I hereby certify that I have personal knowledge of the ages of the occupants of this household and that at least one occupant is 55 years of age or older.""  Actual proof of age should be obtained at the application stage to avoid false reporting  -  no defense to a failure to achieve the 80-20 ration.</p><p>The regs also allow for other proof of age if an existing resident refuses to provide it.  HUD states that ""[I]f the occupants ... refuse to comply with the age verification procedures, the [management] may, if it has sufficient evidence, consider the unit to be occupied by at least one person 55 years of age or older.  Such evidence may include: (1) Government records or documents, such as a local household census; (2) Prior forms or applications; or (3) A statement from an individual who has personal knowledge of the age of the occupants.  The individual's statement must set forth the basis for such knowledge and be signed under the penalty of perjury.""</p><p>Thus, the survey could be supplemented by including a sworn declaration or affidavit by any person with personal knowledge of the age of the resident's age.  In past cases where proof of age was critically important, private investigation of public records to obtain that information has been conducted to provide such knowledge.  Remember however, that obtaining proof of age ""after the fact"" shows compliance with the 2-year survey requirement, but does not substitute for a consistent practice of securing the required information at the time of processing the tenancy application.</p><p>HUD gives the following example as acceptable: ""the owner of a mobile home park where the residents own the coach but rent the land requires a statement of whether at least one occupant is 55 years of age or older before any sublease or new rental.""  In other words, the qualification procedure can be instituted within the application process itself.  HUD states such an example (""All new leases, new purchase agreements, or new applications contain a provision directly above the signatory line for leases, asserting that at least one occupant or the swelling will be 55 years of age or older.  In addition the community surveys all current residents for their occupancy status in compliance with the 55 - or-older requirements"").  Actual proof of age should always be required with submission of the tenancy application as well.</p><h2>Conclusion</h2><p>The continuing survey requirement is mandatory.  Whether failure to comply will be fatal to the assertion of ""older persons"" status is unknown, but this survey requirement is part of the ""intent"" prong of operating an ""older persons"" community.  In sum, it is time to compile the summary for your park.</p><p>(Reprinted with permission from MHI)</p><h2>Do you operate a 55 &amp; Older Community?</h2><h2>Do you have the necessary MHCO Forms for 55 &amp; Older Communities?</h2><h2>MHCO has the Resources You Need!</h2><p>If you are one of the many members of MHCO who own and operate a 55 &amp; Older manufactured home community - MHCO has the resources you need to keep that community compliant with current HUD rules.</p><ul><li>Addendum      to the Rent/Lease Agreement for Age 55 &amp; Older Communities (MHCO Form      71A)</li><li>55      &amp; Older Community - Occupation Determination and Age Verification      (MHCO Form 71B)</li><li>55      &amp; Older Community HUD Verification of Occupancy Survey (MHCO Form 71C)</li></ul><p>These are excellent tools to use in the effective management of your 55 &amp; Older community. Get the most out of your MHCO membership by purchasing and using MHCO Forms.<span>&nbsp;</span></p>",839,1,1298919234,1402693692,1,0,0,0,0